<?xml version="1.0" encoding="UTF-8"?>
<!--
La Password andrÃ  modificata con un algoritmo di criptaggio, intanto la inserisco in chiaro
-->
<amministratori><!-- xmlns="http://www.musicbreak.com" 
            xmlns:xs="http://www.w3.org/2001/XMLSchema-instance" 
            xs:schemaLocation="http://www.musicbreak.com/data/XML/XMLS Amministratori.xsd">-->
    <admin id="0">
        <username>baronerampante</username>
        <password>malpelo</password>
    </admin>
    <admin id="1">
        <username>tecnoboy</username>
        <password>tunztunz789</password>
    </admin>
    <admin id="2">
        <username>getlucky</username>
        <password>daftpunk90</password>
    </admin>
    <admin id="3">
        <username>bandegialla</username>
        <password>yellow1212</password>
    </admin>
    <admin id="4">
        <username>optimusprime</username>
        <password>lego4ever</password>
    </admin>
    <admin id="5">
        <username>alessandro92</username>
        <password>alexthegr8</password>
    </admin>
</amministratori>